{
  "schema_version": "1.0.0",
  "report_type": "ksl_scorecard_run_report",
  "run_metadata": {
    "run_id": "rc1-demo-2026-04-15-001",
    "release_lane": "v2.1.0-rc1",
    "manuscript_version": "Kitcey_2026_KSL_as_a_Quantum-Classical_Bridge.v.2.1.0-rc1",
    "timestamp_utc": "2026-04-15T18:20:00Z",
    "operator": "GitHub Copilot",
    "command_invocation": "python validate_scorecard_run_report.py scorecard_run_report.example.json --schema scorecard_run_report.schema.json",
    "random_seed_policy": "fixed",
    "random_seed": 271828
  },
  "inputs_bundle": {
    "datasets": [
      {
        "name": "bridge_operator_timeseries",
        "path_or_uri": "bridge_operator_timeseries.csv",
        "digest": "4f1d1d8d7f9e0a0db64b6bc5f8ec4d8f99fcbf6e8859d9d7f813e45d7503d7a1",
        "digest_algorithm": "SHA-256",
        "role": "primary_timeseries"
      },
      {
        "name": "bridge_operator_sensitivity_summary",
        "path_or_uri": "bridge_operator_sensitivity_summary.csv",
        "digest": "8c2bf4a8f4cc3bd72dd5f6777785889ef8f1d1dbf31ff4cc1faa6a0f8b1a1082",
        "digest_algorithm": "SHA-256",
        "role": "sensitivity_summary"
      }
    ],
    "preprocessing_policy": "Canonical CSV parse, fixed column normalization, branch tracking frozen before scoring, no post-hoc threshold edits.",
    "calibration_window": {
      "a_min": 0.15,
      "a_max": 0.55,
      "chi_min": 0.0,
      "chi_max": 0.72,
      "label": "bounded calibration window"
    },
    "held_out_window": {
      "a_min": 0.56,
      "a_max": 0.85,
      "chi_min": 0.0,
      "chi_max": 0.95,
      "label": "held-out stress extension"
    },
    "sample_counts": {
      "calibration_samples": 150,
      "held_out_samples": 48,
      "notes": "Held-out window uses the frozen operator family without retuning."
    },
    "tolerance_bands": [
      {
        "metric": "gap_closure_error",
        "rule": "absolute_error <= tolerance",
        "value": 0.02,
        "units": "dimensionless"
      },
      {
        "metric": "retention_ordering_violation_rate",
        "rule": "fraction <= tolerance",
        "value": 0.05,
        "units": "fraction"
      }
    ]
  },
  "freeze_hash": {
    "algorithm": "SHA-256",
    "value": "0d66d0b7f93b0c4b71f0ca89f6aa4e55af0f6d723652f9b778d64833f6a9a6db",
    "scope": [
      "generator_specification",
      "coarse_graining_map",
      "thresholds",
      "input_bundle"
    ],
    "canonicalization_method": "UTF-8 JSON canonicalization with sorted keys over frozen config bundle."
  },
  "row_outcomes": [
    {
      "row_id": "symmetry_conservation_class",
      "row_label": "Symmetry/conservation class",
      "required_row": true,
      "measured_statistics": [
        {
          "name": "conserved_charge_residual",
          "value": 0.0,
          "units": "dimensionless",
          "threshold_rule": "must equal 0 within numerical tolerance"
        }
      ],
      "uncertainty_intervals": [
        {
          "name": "conserved_charge_residual_ci95",
          "lower": 0.0,
          "upper": 0.0,
          "confidence_level": 0.95
        }
      ],
      "calibration_status": "Pass",
      "held_out_status": "Pass",
      "rationale": "The same reduced conserved-charge algebra closes on both windows without channel redefinition."
    },
    {
      "row_id": "gap_protection_logic",
      "row_label": "Gap-protection logic",
      "required_row": true,
      "measured_statistics": [
        {
          "name": "classical_supporting_gap_min",
          "value": 0.11,
          "units": "dimensionless",
          "threshold_rule": "must remain positive before declared closure point"
        },
        {
          "name": "gap_closure_error",
          "value": 0.01,
          "units": "dimensionless",
          "threshold_rule": "absolute_error <= 0.02"
        }
      ],
      "uncertainty_intervals": [
        {
          "name": "gap_closure_error_ci95",
          "lower": 0.006,
          "upper": 0.014,
          "confidence_level": 0.95
        }
      ],
      "calibration_status": "Pass",
      "held_out_status": "Pass",
      "rationale": "A low-leakage band persists where claimed and closure is tracked continuously under frozen branch policy."
    },
    {
      "row_id": "leakage_retention_geometry",
      "row_label": "Leakage/retention geometry",
      "required_row": true,
      "measured_statistics": [
        {
          "name": "retention_ordering_violation_rate",
          "value": 0.02,
          "units": "fraction",
          "threshold_rule": "fraction <= 0.05"
        }
      ],
      "uncertainty_intervals": [
        {
          "name": "retention_ordering_violation_rate_ci95",
          "lower": 0.01,
          "upper": 0.03,
          "confidence_level": 0.95
        }
      ],
      "calibration_status": "Pass",
      "held_out_status": "Pass",
      "rationale": "Projected propagator overlaps preserve the same qualitative retention hierarchy across both stress windows."
    },
    {
      "row_id": "projector_derived_observables",
      "row_label": "Projector-derived observables",
      "required_row": true,
      "measured_statistics": [
        {
          "name": "independent_kernel_count",
          "value": 0,
          "units": "count",
          "threshold_rule": "must equal 0"
        }
      ],
      "uncertainty_intervals": [
        {
          "name": "independent_kernel_count_ci95",
          "lower": 0,
          "upper": 0,
          "confidence_level": 0.95
        }
      ],
      "calibration_status": "Pass",
      "held_out_status": "Pass",
      "rationale": "Occupancy and retention observables are reconstructed from the same frozen projector-propagator stack with no auxiliary kernel."
    },
    {
      "row_id": "threshold_mechanism",
      "row_label": "Threshold mechanism",
      "required_row": true,
      "measured_statistics": [
        {
          "name": "chi_crit_branch_discontinuities",
          "value": 0,
          "units": "count",
          "threshold_rule": "must equal 0"
        }
      ],
      "uncertainty_intervals": [
        {
          "name": "chi_crit_branch_discontinuities_ci95",
          "lower": 0,
          "upper": 0,
          "confidence_level": 0.95
        }
      ],
      "calibration_status": "Pass",
      "held_out_status": "Pass",
      "rationale": "The threshold remains branch-consistent and is extracted from gap closure rather than introduced as a fitted map."
    }
  ],
  "uv_gate_outcomes": [
    {
      "gate_id": "UV1",
      "status": "Not Triggered",
      "trigger_evidence": "An admissible generator exists over the bounded domain and satisfies the declared contract checks.",
      "linked_rows": [
        "symmetry_conservation_class"
      ]
    },
    {
      "gate_id": "UV2",
      "status": "Not Triggered",
      "trigger_evidence": "Derived coefficients and observable construction remain within sign and reducibility constraints.",
      "linked_rows": [
        "projector_derived_observables",
        "threshold_mechanism"
      ]
    },
    {
      "gate_id": "UV3",
      "status": "Not Triggered",
      "trigger_evidence": "The classical-supporting band remains stable and leakage diagnostics stay within predeclared tolerance.",
      "linked_rows": [
        "gap_protection_logic",
        "leakage_retention_geometry",
        "threshold_mechanism"
      ]
    },
    {
      "gate_id": "UV4",
      "status": "Not Triggered",
      "trigger_evidence": "No regime-dependent incompatibility in symmetry, gap, or leakage structure is observed on the tested windows.",
      "linked_rows": [
        "symmetry_conservation_class",
        "gap_protection_logic",
        "leakage_retention_geometry",
        "projector_derived_observables"
      ]
    }
  ],
  "final_decision": {
    "decision": "Accept",
    "justification": "All required rows pass on calibration and held-out windows and no UV gate is triggered under the frozen report hash.",
    "based_on_rows": [
      "symmetry_conservation_class",
      "gap_protection_logic",
      "leakage_retention_geometry",
      "projector_derived_observables",
      "threshold_mechanism"
    ],
    "triggered_gates": []
  },
  "notes": [
    "Demonstration instance for schema validation and validator smoke testing.",
    "Values are illustrative but consistent with the rc1 scorecard contract."
  ]
}